{
  "binding": {
    "agent_id": "agent-main",
    "run_id": "run-delegated-002",
    "session_id": "session-delegated-001",
    "turn_id": "turn-delegated-002",
    "user_id": "user-opaque-001",
    "workspace_id": "workspace-demo"
  },
  "context": {
    "byte_length": 17,
    "bytes_base64": "TmV4dCB0dXJuIGNvbnRleHQ=",
    "encoding": "base64",
    "media_type": "text/plain; charset=utf-8",
    "sha256": "d8037d10cc7d5d9106963765fe413d5a4860cdc74ac60d4af23e17c583a5adc0"
  },
  "contract_id": "atmem.delegated-context-provider.v1",
  "created_at": "2026-09-01T12:00:00Z",
  "decision": "inject",
  "expires_at": "2026-09-01T12:02:00Z",
  "idempotency_key": "dcp-627950a0362268ef7fa6a82aef0f3e2e0a4ee08eee70951107fcce4cca5a4766",
  "nonce": "AAAAAAAAAAAAAAAAAAAAAA",
  "provider": {
    "id": "storizon",
    "instance_id": "storizon-demo-instance",
    "version": "0.2.0a1"
  },
  "receipt": {
    "contract_id": "storizon.agent-experience-receipt.v2",
    "id": "axr2-delegated-context-001",
    "sha256": "aaaaaaaaaaaaaaaaaaaaaaaaaaaaaaaaaaaaaaaaaaaaaaaaaaaaaaaaaaaaaaaa"
  },
  "signature": {
    "algorithm": "ed25519",
    "key_id": "storizon-demo-key-1",
    "profile": "ed25519-jcs-subset-v1",
    "signed_payload_sha256": "8c8cd3721b9a1507b613c51dfd2c88545063ed18a005804b8dd3bcb912a4af19",
    "value_base64": "q72/KQ5izsp0WTwQ1sg51HHsZrjUF65JJMCQwKfIT2odpEraGkkb9au7iWnn3jVKfj2+LVI4Lhar3ecQdreeDg=="
  },
  "source_refs": ["opaque:memory:decision-001"],
  "withhold_reason": null
}
